{"access_logging_required":true,"agreement_id":"custody-template-replace-me","allowed_source_roots":["C:/customer/approved-source-root"],"approval_envelope_digest":null,"approval_evidence_mode":"CUSTOMER_ENVIRONMENT_SELF_ASSERTED","approval_evidence_refs":[],"asserted_approver_ref":null,"authorized_role_refs":["role:replace-me"],"backup_policy":"EXCLUDED_FROM_VENDOR_BACKUPS","content_digest":"sha256:fab2dd25172c9038d59425d3ccc413bbb25016cb904912d2bd8e4b4139ed8ec3","cross_border_processing":"PROHIBITED_UNLESS_CUSTOMER_APPROVES","customer_ref":"customer:replace-me","deletion_attestation_required":true,"deletion_request_sla_days":5,"derived_artifact_retention_days":30,"effective_from":"2026-01-01T00:00:00Z","encryption_at_rest_required":true,"encryption_in_transit_required":true,"expires_at":null,"incident_notification_hours":24,"model_training_use":"PROHIBITED","processing_location":"CUSTOMER_ENVIRONMENT","regression_fixture_permission":"NO_RETENTION","schema_version":"organic-source-custody-agreement-1.0","source_retention_days":0,"status":"DRAFT","subprocessor_policy":"NO_UNAPPROVED_SUBPROCESSORS"}
